Group,URL,Description,Info
 Web Services ,redirection-new.php?URL=d2b90f89235cd210579012a8e8f325c58609b362de36599f5d7e85bba70b9b6f&NAME=PDB_Hydro,PDB_Hydro,". Provides tools for mutating (change side-chains of a PDB file automatically, repair missing side-chains in a PDB file, construct polar hydrogen atoms and assig partial charges for electrostatic calculations) and solvating PDB files."
 Web Services ,redirection-new.php?URL=cc31d26ecace74f44346ccde9513346408975f4f15b28879ad8c81b955bf135b&NAME=POLYVIEW-MM,POLYVIEW-MM,". Web-based platform for animation and analysis of molecular simulations. Enables animation of trajectories generated by molecular dynamics and related simulation techniques, as well as visualization of alternative conformers, e.g. obtained as a result of protein structure prediction methods or small molecule docking."
 Web Services ,redirection-new.php?URL=a7e7a345a3c656cec32e4fac1cac8d8598cf9e2d4c1422740e87e63f0e21a090&NAME=CLICK,CLICK,". Web server for superimposing the 3D structures of any pair of biomolecules (proteins, DNA, RNA, etc.). The server makes use of the Cartesian coordinates of the molecules with the option of using other structural features such as secondary structure, solvent accessible surface area and residue depth to guide the alignment. Help establishing protein relationships by detecting similarities in structural subdomains, domains and topological variants or to recognize conformational changes that may have occurred in structural domains or subdomains in one structure with respect to the other."
 Web Services ,redirection-new.php?URL=84c4ecd42e56fd9dec8019ac16df51e028e43d21b3a05a480caa95f9d7583331&NAME=SLITHER,SLITHER,. Web server for generating contiguous conformations of substrate molecules entering into deep active sites of proteins or migrating across membrane transporters. Predicts whether a substrate molecule can crawl through an inner channel or a half-channel of proteins across surmountable energy barriers.
 Web Services ,redirection-new.php?URL=7f09a25c1fac94eb0690b931fc5d2d7d6b3a1195278ae77ac142271c1890a841&NAME=AlloDeco,AlloDeco,". Server that implements a novel model for allostery. It computes the thermodynamic coupling between functional sites in proteins and then determines the contribution of specific interactions to that coupling. First, a 3-dimensional protein structure (PDB file) is transformed into a Gaussian Network Model. The coupled motions of two sites are then decomposed using Canonical Correlation Analysis. Finally, the statistical mechanics-based thermodynamic coupling function formalism is applied to identify interactions that mediate the thermodynamic coupling between the canonical pairs of motions. Developed at Weill Cornell Medical College, New York, United States."
 Web Services ,redirection-new.php?URL=e9eb3bcef8295b73a21f5a552f029f6e9a288945d5487afe24db8838c42424fa&NAME=R.E.D.Server,R.E.D. Server,". Web service designed to automatically derive RESP and ESP charges, and to build force field libraries for new molecules/molecular fragments."
 Web Services ,redirection-new.php?URL=5a7ba168111b73eb173a0600616991a573773c76b33a2d4c02ab53f1e04781b1&NAME=Chemsolwebservice,Chemsol web service,". Web service for the calculations of solvation free energies using the Langevin Dipoles (LD) solvation model, in which the solvent is approximated by polarizable dipoles fixed on a cubic grid.Also exists as a standalone program. Provided by the Warshel's group at the university of Southern California."
 Web Services ,redirection-new.php?URL=4f071ea8da74fc96e4ab05d8b312425d52805cbb6f7d8f5b71fcb3bd1793a08f&NAME=MovieMaker,MovieMaker,". Web server that allows short (~10 sec), downloadable movies to be generated of protein dynamics. It accepts PDB files or PDB accession numbers as input and automatically outputs colorful animations covering a wide range of protein motions and other dynamic processes (simple rotation, morphing between two end conformers, short-scale, picosecond vibrations,  ligand docking, protein oligomerization, mid-scale nanosecond (ensemble) motions and protein folding/unfolding). Note: MovieMaker is not a molecular dynamics server and does not perform MD calculations. Provided by the University of Alberta, Canada."
 Web Services ,redirection-new.php?URL=6d06e1c9f39a88b3ddff8ba21fa20af3e55872490805961c275f5d55c49a2527&NAME=Superpose,Superpose,". Protein superposition server, using a modified quaternion approach. From a superposition of two or more structures, it generates sequence alignments, structure alignments, PDB coordinates, RMSD statistics, Difference Distance Plots, and interactive images of the superimposed structures. Provided by the University of Alberta, Canada."
 Web Services ,redirection-new.php?URL=336134ad11420b2d79c623a33febc6b67fa4a7564cd5ec4e98b2718c10e376ee&NAME=ArbAlign,ArbAlign,". Web implmentation of the Kuhn-Munkres algorithm to optimally align two arbitrarily ordered isomers. Code and web interface provided by the Bucknell University, Lewisburg, USA."
